id;tag;short_name;full_name;description;url;category
48;app.qq;Tencent QQ;Tencent QQ Instant Messenger;Tencent QQ, popularly known as QQ, is an instant messaging software service based in China.  Nearly 1 billion active accounts use QQ for chat, gaming, music, shopping and more.;http://www.qq.com;Messaging
68;app.msn;MSN;Microsoft Network;MSN - also known as the Microsoft Network - is a web portal that provides content on news, weather, sports, lifestyle and other general topics;http://www.msn.com;Portal
70;app.yahoo;Yahoo;Yahoo;Yahoo was one of the early pioneers of the web era of the Internet.  The web site is a traditional portal that offers news, weather, sports, search, webmail, mapping and other general information.;https://www.yahoo.com;Business
119;app.facebook;Facebook;Facebook;Facebook is an online social networking service that allows people to share information, photos, videos and messages amongst other trusted individuals. The service is used by over 1 billion users every month.;https://www.facebook.com/;Social Media
120;app.twitter;Twitter;Twitter;Twitter is an online social networking service that allows users to post 140-character messages to other users or to the general public.  The service is used by hundreds of millions of users every month.;https://twitter.com;Social Media
121;app.dropbox;Dropbox;Dropbox;Dropbox provides file sharing and storage services to end users and organizations.  A special shared folder can be synchronized and shared across multiple devices: mobile, tablets, laptops, etc.;https://www.dropbox.com;File Sharing
122;app.gmail;Gmail;Gmail;Gmail is a free and popular mail service provided by Google.  The service provides a webmail interface as well as native IMAP/POP access for mobile and desktop mail clients.;https://www.google.com/gmail/about;Mail
123;app.google-maps;Google Maps;Google Maps;Google Maps is a desktop and mobile mapping service provided by Google.  It offers regular street maps, transit line information, satellite imagery, real-time traffic conditions, street views, turn-by-turn route planning, and more.;https://maps.google.com;Reference
124;app.youtube;YouTube;YouTube;YouTube is an online video-sharing service that allows anyone to upload, view and share videos.  Most of the YouTube content comes from individuals, but you can also find TV shows, movies, music videos and other content from large media corporations.;https://www.youtube.com;Streaming Media
125;app.skype;Skype;Skype;Skype is a popular voice and video chat service used by hundreds of millions of users every month.  On the Skype platform, users can also exchange images, videos, and documents over their chat sessions.;https://www.skype.com;VoIP/Conferencing
126;app.google;Google;Google;Google is an online technology company that provides not only the most popular search engine, but also online advertising technologies, cloud computing, software, and hardware.;https://www.google.com;Business
133;app.netflix;Netflix;Netflix;Netflix is an online video streaming service that provides movies, TV shows, documentaries and other video formats.;https://www.netflix.com;Streaming Media
134;app.last-fm;Last.fm;Last.fm;Last.fm was a pioneer in the audio streaming market in the early 2000s.  Today, the web site is focused on providing custom music recommendations based on user preferences and listening habits.;https://www.last.fm;Streaming Media
135;app.waze;Waze;Waze;Waze is a map and navigation tool available on mobiles and tablets.  The GPS-based app provides turn-by-turn navigation, live traffic, as well as crowd-sourced information on traffic conditions: accidents, construction, speed traps, and more.;https://www.waze.com;Reference
140;app.apple;Apple;Apple;Apple revolutionized personal technology with the introduction of the Macintosh in 1984. Today, Apple leads the world in innovation with iPhone, iPad, Mac, and other products.;https://www.apple.com;Business
141;app.webex;Webex;Webex;WebEx is a video conferencing solution used for online meetings and presentations, webinars, town halls, online courses and training, and online presentations.;https://www.webex.com;VoIP/Conferencing
142;app.whatsapp;WhatsApp;WhatsApp Messenger;More than 1 billion people in over 180 countries use WhatsApp to stay in touch with friends and family, anytime and anywhere. WhatsApp is free and offers simple, secure, reliable messaging and calling, available on phones all over the world.;https://www.whatsapp.com;Messaging
143;app.apple-icloud;Apple iCloud;Apple iCloud;Apple iCloud provides online access to personal photos, videos, documents, notes, contacts, and more.  The service is provided to Apple product users.;https://www.icloud.com;File Sharing
145;app.apple-itunes;Apple iTunes;Apple iTunes;iTunes is the world’s best way to play — and add to — your collection of music, movies, TV shows, apps, audiobooks, and more. Right on your Mac or PC.;https://www.apple.com/itunes;Arts and Entertainment
147;app.windows-update;Windows Update;Microsoft Windows Update;Windows Update is the online extension of Microsoft Windows that helps you keep your computer up-to-date.;https://www.microsoft.com/windows;OS/Software Updates
149;app.tuenti;Tuenti;Tuenti;Tuenti is a mobile operator brand owned by Tuenti Technologies, S.L.U, a Spain-based tech company, that focus in providing a cloud experience through their own application and their website to their customers.;http://tuenti.com;Social Media
156;app.spotify;Spotify;Spotify;Spotify is a popular music streaming service available on mobile, tablets, game consoles and more.  The company has a large reach with over 100 million users and more than 20 million songs.;https://www.spotify.com;Streaming Media
163;app.tor;Tor Client;Tor Project Client;Tor is a free software that prevents people from learning your location or browsing habits by letting you communicate anonymously on the Internet. It also helps you bypass censorship online.;https://www.torproject.org;VPN and Proxy
176;app.wikipedia;Wikipedia;Wikipedia;Wikipedia is a free online encyclopedia, created and edited by volunteers around the world and hosted by the Wikimedia Foundation.;https://www.wikipedia.org;Reference
178;app.amazon;Amazon;Amazon;Amazon is an e-commerce, shipping, cloud computing, and digital streaming provider.  They are one of the largest online shopping companies in the world.;https://www.amazon.com;Business
179;app.ebay;eBay;eBay;Buy and sell electronics, cars, fashion apparel, collectibles, sporting goods, digital cameras, baby items, coupons, and everything else on eBay, the world's online marketplace.;http://www.ebay.com;Shopping
180;app.cnn;CNN;Cable News Network;View the latest news and breaking news today for U.S., world, weather, entertainment, politics and health at CNN.com.;http://www.cnn.com;News
186;app.vevo;Vevo;Vevo;Vevo brings a library of 100,000 HD music videos, exclusive original programming and live concert performances.;https://www.vevo.com;Streaming Media
187;app.pandora;Pandora;Pandora Internet Radio;Pandora is free, personalized radio that plays music you'll love. Discover new music and enjoy old favorites.;https://www.pandora.com/;Streaming Media
193;app.kakaotalk;Kakao Talk;Kakoa Talk Mobile Messenger;KakaoTalk  is a free mobile instant messaging application for smartphones with free text and free call features.;http://www.kakao.com/talk;Messaging
195;app.twitch;Twitch;Twitch;Twitch is the world's leading video platform and community for gamers. More than 45 million gamers gather every month on Twitch to broadcast, watch and chat about gaming.;https://www.twitch.tv;Streaming Media
196;app.quickplay;QuickPlay;QuickPlay Media;Quickplay Media is a privately held company that provides managed services for the distribution of premium multi-screen video to IP-connected devices. The company’s managed services platform, OpenVideo, powers mobile video services for live TV and more.;http://www.quickplay.com;Arts and Entertainment
197;app.opendns;OpenDNS;OpenDNS;OpenDNS prevents cyberattacks by using cloud-delivered DNS-based security services.  The product is now part of the Cisco Umbrella ecosystem.;https://www.opendns.com;Cybersecurity
199;app.snapchat;Snapchat;Snapchat;Snapchat lets you easily talk with friends, view Live Stories from around the world, and explore news in Discover.;https://www.snapchat.com;Messaging
200;app.deezer;Deezer;Deezer;Deezer is a French online music streaming service. It allows users to listen to music content from record labels, including Universal Music Group, Sony Music and Warner Music Group;https://www.deezer.com;Streaming Media
201;app.instagram;Instagram;Instagram;Instagram is a social media platform that emphasizes photo and video sharing via its mobile app. Users can take, edit, and publish visual content to followers and the general public.;https://www.instagram.com;Social Media
202;app.microsoft;Microsoft;Microsoft;At Microsoft our mission and values are to help people and businesses throughout the world realize their full potential.;https://www.microsoft.com;Business
203;app.hotspot-shield;Hotspot Shield;Hotspot Shield;Hotspot Shield's VPN provides privacy, security, and access to blocked content. Download our free VPN, available for Windows, Mac, iPhone, and Android;https://www.hotspotshield.com;VPN and Proxy
204;app.orange-cinema-series;OCS;Orange Cinéma Séries;OCS, or previously known as Orange Cinéma Séries, is a French group of dedicated movies/series TV channels operated by Orange S.A.;http://ocs.fr;Streaming Media
205;app.office-365;Microsoft Office;Microsoft Office;Microsoft Office and Office 365 offer a suite of business productivity software solutions: word processor, spreadsheet, calendaring, mail client, slide presentation and more.;https://products.office.com;Business
206;app.cloudflare;CloudFlare;CloudFlare;Cloudflare is an infrastructure and website security company that provides content delivery network services, DDoS mitigation, Internet security, and distributed domain name server services.;https://www.cloudflare.com;CDN
207;app.microsoft-onedrive;Microsoft OneDrive;Microsoft OneDrive;Store photos and docs online. Access them from any PC, Mac or phone. Create and work together on Word, Excel or PowerPoint documents.;https://onedrive.live.com;File Sharing
210;app.weibo;Weibo;Weibo;Sina Weibo is a Chinese microblogging (weibo) website. Akin to a hybrid of sites Facebook and Twitter, it is one of the most popular sites in China, in use by well over 30% of Internet users.;http://weibo.com;Social Media
10000;app.doubleclick;DoubleClick;DoubleClick by Google;DoubleClick is an online advertising service that was acquired by Google.  The apps and services have now been merged into the Google Marketing.;https://www.doubleclickbygoogle.com;Advertiser
10001;app.analytics;Google Analytics;Google Analytics;Google Analytics provides advertising and analytics engines for third party organizations.  Services include ad networks, user tracking and web traffic reporting.  The product merged with the Google Marketing Platform.;https://analytics.google.com;Advertiser
10002;app.github;GitHub;GitHub;GitHub is a web-based Git or version control repository and Internet hosting service. It offers all of the distributed version control and source code management (SCM) functionality of Git as well as adding its own features.;https://github.com;Technology
10003;app.steam;Steam;Steam by Valve;Steam is a digital distribution platform developed by Valve Corporation, which offers digital rights management (DRM), multiplayer gaming, and social networking services.;http://store.steampowered.com;Games
10004;app.google-plus;Google Plus;Google Plus;Google Plus was a social network from Google. Due to low user engagement, the service was discontinued in 2019 and merged with the Google Currents platform in Google Workspace.;https://en.wikipedia.org/wiki/Google+;Social Media
10005;app.google-hangouts;Google Meet;Google Meet;Google Meet (formerly Hangouts Meet) is a unified communications service that allows members to initiate and participate in text, voice or video chats, either one-on-one or in a group.;https://meet.google.com;VoIP/Conferencing
10006;app.reverse-dns;Reverse DNS;Reverse DNS Lookup;The in-addr.arpa DNS system is used to perform reverse DNS lookups.  This allows systems to query a DNS hostname for a given IP address.;https://www.iana.org/domains/arpa;Technology
10007;app.android;Android;Google Android;Android is a mobile operating system developed by Google, based on the Linux kernel and designed primarily for touchscreen mobile devices such as smartphones and tablets.;https://www.android.com;OS/Software Updates
10008;app.espn;ESPN;ESPN;Visit ESPN to get up-to-the-minute sports news coverage, scores, highlights and commentary for NHL, NFL, MLB, NBA, College Football, NCAA Basketball and more.;http://www.espn.com;Sports
10009;app.thescore;theScore;theScore;theScore operates mobile sports applications, websites and chatbots, which deliver sports news, scores and stats across all major leagues and competitions. Its core revenue generating business is that of its mobile applications.;https://www.thescore.com;Sports
10010;app.reddit;Reddit;Reddit;Reddit is essentially a web-based bulletin board system.  The site's content is divided into numerous categories, and the most popular posts from these 'subreddits' are visible on the front page to those who browse the site without an account.;https://www.reddit.com;Social Media
10011;app.akamai;Akamai;Akamai;Akamai is a leading content delivery network (CDN) services provider for media and software delivery, and cloud security solutions.;https://www.akamai.com;CDN
10012;app.quantcast;Quantcast;Quantcast;Quantcast Corporation is a digital marketing company that provides free audience demographics, insights, and analytics and delivers real-time advertising.;https://www.quantcast.com;Advertiser
10013;app.amazon-advertising;Amazon Advertising;Amazon Advertising;Amazon Advertising provides tools to advertise your product, book, app, or website with Amazon.  The platform includes a number of acquired technologies: Rocket Fuel. Sizmek, and others.;https://advertising.amazon.com;Advertiser
10014;app.cbc;CBC;Canadian Broadcasting Corporation;CBC.ca is Canada's Online Information Source. Comprehensive web site for news, entertainment, sports, business, and a complete guide to CBC-TV, CBC Radio and CBC News Network.;http://www.cbc.ca;Arts and Entertainment
10015;app.globe-and-mail;The Globe and Mail;The Globe and Mail;The Globe and Mail offers the most authoritative news in Canada, featuring national and international news.;https://www.theglobeandmail.com;News
10016;app.rockstar-games;Rockstar Games;Rockstar Games;Rockstar Games is a video game publisher, best known for their Grand Theft Auto, Red Dead, Midnight Club, Max Payne, and Manhunt series of video games.;http://www.rockstargames.com;Games
10017;app.outlook;Microsoft Outlook;Microsoft Outlook;Outlook.com is a web-based suite of webmail, contacts, tasks, and calendaring services from Microsoft.;https://outlook.live.com;Mail
10018;app.receipt-bank;Receipt Bank;Receipt Bank;Receipt Bank is an award-winning bookkeeping platform that saves accountants, small businesses, and sole traders valuable time and money. Get started today!;https://www.receipt-bank.com;Financial
10019;app.rbc;RBC Royal Bank;Royal Bank of Canada;Explore the personal and business financial services and products that RBC offers to individuals, small businesses and commercial clients in Canada.;http://www.rbcroyalbank.com;Financial
10020;app.playstation;Playstation;Sony Playstation;PlayStation is a gaming brand that consists of four home video game consoles, as well as a media center, an online service, a line of controllers, two handhelds and a phone, as well as multiple magazines.;https://www.playstation.com;Games
10021;app.teamsnap;TeamSnap;TeamSnap;The #1 sports team management app makes communication and organization a breeze. Clubs and leagues love us too.;https://www.teamsnap.com;Sports
10022;app.bing;Bing;Bing;Bing is a web search engine owned and operated by Microsoft.  The service provides a variety of search services, including web, video, image and map search products.;http://www.bing.com;Portal
10023;app.verisign;Verisign;Verisign;Verisign operates a diverse array of network infrastructure including managed DNS, domain registry services, distributed denial-of-service (DDoS) attack mitigation and cyber-threat reporting.;https://www.verisign.com;Cybersecurity
10024;app.comodo;Comodo;Comodo;Comodo delivers cybersecurity solutions to protect businesses, schools, and government organizations.  The company's SSL business was sold to Sectigo.;https://www.comodo.com;Cybersecurity
10025;app.symantec;Symantec;Symantec;Symantec provides security products and solutions to protect small, medium, and enterprise businesses from advanced threats, malware, and other cyber attacks.;https://www.symantec.com;Cybersecurity
10026;app.mlb;MLB;Major League Baseball;Coverage includes audio and video clips, interviews, statistics, schedules and exclusive stories from Major League Baseball.;https://www.mlb.com;Sports
10027;app.nhl;NHL;National Hockey League;The official National Hockey League website including news, rosters, stats, schedules, teams, and video.;https://www.nhl.com;Sports
10028;app.minecraft;Minecraft;Minecraft;Minecraft is a popular video game that enables players to build constructions out of textured cubes in a 3D generated world. Other activities in the game include exploration, resource gathering, crafting, and combat.;http://minecraft.net;Games
10029;app.amazon-kindle;Kindle;Amazon Kindle;The Amazon Kindle is a series of e-readers that enable users to browse, buy, download, and read e-books, newspapers, magazines and other digital media via wireless networking to the Kindle Store.;https://en.wikipedia.org/wiki/Amazon_Kindle;Device/IoT
10030;app.xero;Xero;Xero;Xero is online accounting software for small businesses. Use Xero to manage invoicing, bank reconciliation, bookkeeping & more.;https://www.xero.com;Financial
10031;app.clearcenter;ClearCenter;ClearCenter;ClearCenter is a hybrid IT company that delivers products that are simple, scalable, and affordable. ClearCenter builds products for ClearOS, the #1 small business server.;https://www.clearcenter.com;Business
10032;app.egloo;eGloo;eGloo;eGloo powers Netify - a solution that answers the question: what is happening on my network? Protocol detection, bandwidth reporting, DPI and more.;https://www.egloo.ca;Business
10033;app.netify;Netify;Netify;Netify is a solution that answers the question: what is happening on my network? Protocol detection, bandwidth reporting, DPI and more.;https://www.egloo.ca/products/netify;Technology
10034;app.hubspot;HubSpot;HubSpot;HubSpot is an inbound marketing and sales platform that helps companies attract visitors, convert leads, and close customers.;https://www.hubspot.com;Advertiser
10035;app.shopify;Shopify;Shopify;Shopify is an e-commerce platform that has everything needed to sell online, on social media, or in person.;https://www.shopify.com;Shopping
10036;app.internal-network;Internal Network;Internal Network;Internal private networks using commonly used suffices: .local, .lan, .home, etc.;https://www.iana.org/domains;Business
10037;app.ea-games;Electronic Arts;Electronic Arts;Electronic Arts is a leading publisher of games on Console, PC and Mobile.  Games include FIFA, NHL, Madden NFL, Battlefield, The Sims, and many more.;https://www.ea.com;Games
10038;app.userengage;UserEngage;UserEngage;UserEngage.io is a marketing automation platform for big and small companies. It collects all the possible data about users to provide them with personalized messages via chat, email, SMS, forms and pop-ups.;https://userengage.com;Business
10039;app.roblox;ROBLOX;ROBLOX;Roblox is a popular online game platform and game creation system.  The platform allows users to program games and play games created by other users.;https://www.roblox.com;Games
10040;app.life360;Life360;Life360;Life360 is a family locator, messaging tool and communication app all in one.;https://www.life360.com;Business
10041;app.google-ads;Google Marketing;Google Marketing;Though Google is the world's most used search engine, most if its revenues come from advertising products and services.  Google Advertising is a catchall for the various marketing platforms from Google.;https://marketingplatform.google.com/;Advertiser
10042;app.crashlytics;Crashlytics;Crashlytics;Crashlytics is a software bug reporting tool for mobile platforms.  It is most powerful, yet lightest weight crash reporting solution for iOS and Android.;http://try.crashlytics.com;Business
10043;app.transit-app;Transit App;Transit App;Transit App is your real-time urban travel companion. Navigate your city's public transit system with accurate real-time predictions, simple trip planning, step-by-step;https://transitapp.com;Reference
10045;app.comscore;comScore;comScore;comScore, Inc. is the cross-platform measurement company that precisely measures audiences, brands and consumer behavior everywhere.;http://www.comscore.com;Advertiser
10046;app.nintendo;Nintendo;Nintendo;Nintendo is the home of the Wii U console and Nintendo 3DS and Nintendo 2DS systems, plus new and classic games for all ages.;http://www.nintendo.com;Games
10048;app.accuweather;AccuWeather;AccuWeather;AccuWeather provides weather forecasts for both local and international locations. Up-to-the-minute weather reports and conditions are available via mobile and web.;http://www.accuweather.com;News
10049;app.the-weather-network;The Weather Network;The Weather Network;The most current, accurate and reliable weather forecasts and conditions with The Weather Network.;https://www.theweathernetwork.com;News
10050;app.intercom;Intercom;Intercom;Intercom makes customer messaging apps for sales, marketing, and support, connected on one platform. Their mission is to make business personal again.;https://www.intercom.com;Advertiser
10051;app.mixpanel;Mixpanel;Mixpanel;Mixpanel allows organizations learn how people use apps with the world's most advanced mobile & web analytics.;https://mixpanel.com;Advertiser
10052;app.wikispaces;Wikispaces;Wikispaces;Wikispaces Classroom was a social writing platform for education. They made it easy to create a classroom workspace where staff, parents, students, and others could communicate.  Wikispaces closed on January 31, 2019;https://en.wikipedia.org/wiki/Wikispaces;Career and Education
10053;app.queens-university;Queen's University;Queen's University;Established in 1841, Queen's offers a transformative student learning experience and is one of Canada's leading research-intensive universities.;http://queensu.ca;Career and Education
10054;app.fotmob;FotMob;FotMob;The #1 football livescores app and website with scores, news, tables, fixtures and much more from Premier League, Bundesliga, Liga BBVA, MLS and many more.;https://www.fotmob.com;Sports
10055;app.vimeo;Vimeo;Vimeo;Vimeo is a video-sharing website in which users can upload, share and view videos.  It is a great community of creators, fans, filmmakers and brands.;https://vimeo.com;Streaming Media
10056;app.chartbeat;Chartbeat;Chartbeat;Chartbeat is a content intelligence and analytics tools for publishers to measure reader engagement in order to provide data insights to build a loyal audience.;https://chartbeat.com;Advertiser
10057;app.nest;Nest;Nest;Nest is a home automation producer of programmable, self-learning, sensor-driven, Wi-Fi-enabled thermostats, smoke detectors, and other security products.;https://nest.com;Device/IoT
10058;app.soundcloud;SoundCloud;SoundCloud;SoundCloud is a music and podcast streaming platform that lets you listen to millions of songs from around the world, or upload your own.;https://soundcloud.com;Streaming Media
10059;app.fyber;Fyber;Fyber;Fyber solves the business challenge faced by freemium app and game developers, generating sustainable revenue streams through ad monetization.;https://www.fyber.com;Advertiser
10060;app.airbnb;Airbnb;Airbnb;Airbnb operates an online marketplace for lodging, primarily homestays for vacation rentals, and tourism activities.;https://www.airbnb.com;Recreation
10061;app.ntp;Time Synchronization;Time Synchronization;The Network Time Protocol (NTP) is used to synchronize the time of a computer client or server to another server or reference time source, such as a radio or satellite receiver or modem.;http://ntp.org;Technology
10062;app.wish;Wish;Wish;Wish is an online shopping platform that allows users to buy directly from merchants.  The company has come under regulatory pressures due to poor quality and counterfeit goods.;https://www.wish.com;Shopping
10063;app.paypal;PayPal;PayPal;PayPal is the faster, safer way to send money, make an online payment, receive money or set up a merchant account.;https://www.paypal.com;Financial
10064;app.cibc;CIBC;Canadian Imperial Bank of Commerce;CIBC is a North American financial institution providing financial services to customers across retail and small business banking.;https://www.cibc.com;Financial
10065;app.bmo;BMO;Bank of Montreal;BMO offers a wide range of personal banking services including mortgages, credit cards, loans and insurance. Access accounts with 24/7 online banking.;https://www.bmo.com;Financial
10066;app.td;TD;Toronto Dominion Canada Trust;TD Canada Trust products and services include investing, mortgages, banking and small business.;http://www.td.com;Financial
10067;app.tumblr;Tumblr;Tumblr;Post anything (from anywhere!), customize everything, and find and follow what you love.  Create your own Tumblr blog today.;https://www.tumblr.com;Arts and Entertainment
