id;tag;short_name;full_name;description;url;category
10962;app.jpush;jPush;jPush;JPush (from JiGuang/Aurora Mobile) is a large-scale app push platform, pushing more than 500 million messages per day.  The solution offers four types of messages: notifications, custom messages, rich media, and local notifications.;https://docs.jiguang.cn/en/jpush/guideline/intro/;Messaging
10963;app.call-of-duty;Call of Duty;Call of Duty;Call of Duty is a first-person shooter video game franchise published by Activision. Starting out in 2003, it first focused on games set in World War II.;https://www.callofduty.com/;Games
10964;app.instacart;Instacart;Instacart;Instacart is an online grocery platform that offers same-day delivery and pickup services for retailers and consumers.;https://www.instacart.com;Shopping
10965;app.yieldmo;Yieldmo;Yieldmo;Yieldmo's Smart Exchange provides a marketplace for advertisers to create, measure, model, and optimize campaigns for scale and performance.;https://yieldmo.com;Advertiser
10966;app.aniview;Aniview;Aniview;Aniview provides end-to-end video advertising and monetization solutions. Products include video ad servers, players, marketplaces, and other advertising solutions.;https://www.aniview.com;Advertiser
10967;app.lg;LG;Lucky-Goldstar;LG is a Korean-based manufacturer of smart TVs, home appliances, kitchen appliances, air audio systems and more.;https://www.lg.com/;Business
10968;app.peacocktv;Peacock TV;Peacock TV;Peacock is an American over-the-top video streaming service owned and operated by the Television and Streaming division of NBCUniversal, a subsidiary of Comcast.;https://www.peacocktv.com/;Streaming Media
10969;app.vrv;VRV;VRV;VRV is a streaming service owned by Crunchyroll, a subsidiary of Sony's joint venture anime business Funimation Global Group.  The service bundles together anime, speculative fiction and gaming-related channels.;https://vrv.co/unavailable;Streaming Media
10970;app.astellas;Astellas Pharma;Astellas Pharma;Astellas Pharma Inc., based in Tokyo, Japan, is a company dedicated to improving the health of people around the world through the provision of innovative and reliable pharmaceutical products.;https://www.astellas.com;Business
10971;app.meta;Meta;Meta;Meta is the parent company of Facebook, Instagram, WhatsApp, Oculus, and other companies.;https://about.facebook.com/meta;Social Media
10972;app.huawei-cloud;Huawei Cloud;Huawei Cloud;Huawei Cloud is a cloud service provider based in China.  The company provides on-demand cloud computing platforms and APIs to individuals, companies, and governments, on a metered pay-as-you-go basis.;https://www.huaweicloud.com;Hosting
10973;app.huawei-cdn;Huawei CDN;Huawei CDN;Huawei CDN is a Chinese-based content delivery solution.  The solution delivers content from original sources to edge nodes, accelerating content delivery with nearest-node access.;https://www.huaweicloud.com/en-us/product/cdn.html;CDN
10974;app.meta-cdn;Meta CDN;Facebook Network Appliance (FNA);Meta is the parent company of Facebook, Instagram, WhatsApp, Oculus, and others.  The company provides in-house distributed content delivery across ISPs and data centers.;https://about.facebook.com/meta;CDN
10975;app.netlify-hosting;Netlify Hosting;Netlify Hosting;Netlify is a cloud computing company that offers hosting and serverless backend services for web applications and static websites.;https://www.netlify.com;Hosting
10976;app.onetrust;OneTrust;OneTrust;OneTrust helps companies manage privacy, security, and governance requirements in a regulatory environment that constantly changes.;https://www.onetrust.com;Cybersecurity
10977;app.bidtellect;Bidtellect;Bidtellect;Bidtellect is a paid content distribution platform providing marketers with one platform to execute native campaigns across all formats and devices including text, imagery and video;https://bidtellect.com;Advertiser
10978;app.smaato;Smaato;Smaato;Smaato's Digital Ad Tech Platform gives publishers the controls needed to deliver seamless, engaging experiences for global audiences.;https://www.smaato.com;Advertiser
10979;app.technorati;Technorati;Technorati;Technorati is a site aggregator and advertiser.  It provides paid placements for trending news, entertainment, sports, videos, personalized content, web searches, and more.;https://technorati.com;Advertiser
10980;app.tubi;Tubi;Tubi;Tubi is an American over-the-top content platform and ad-supported streaming service owned by Fox Corporation offering online streaming from a library of films and television series for free.;https://tubitv.com/;Streaming Media
10981;app.crate-and-barrel;Crate and Barrel;Crate and Barrel;Crate and Barrel is an international home decor retailer with stores in the US and Canada and franchises in Europe.;https://www.crateandbarrel.com;Shopping
10982;app.watchguard;WatchGuard;WatchGuard;WatchGuard Technologies, Inc. provides unified threat management solutions that combine firewall, virtual private networks (VPN), and security services to protect networks and businesses.;https://www.watchguard.com;Cybersecurity
10983;app.bill-com;Bill.com;Bill.com;Bill.com is a provider of cloud-based software that automates back-office financial operations for small and midsize businesses.;https://www.bill.com;Financial
10984;app.pagerduty;PagerDuty;PagerDuty;PagerDuty is a US-based cloud computing company specializing in a SaaS incident response platform for IT departments;https://www.pagerduty.com;Technology
10985;app.apple-tv;Apple TV;Apple TV;Apple TV+ is a subscription video-on-demand streaming television service by Apple.  It is similar to Netflix, Hulu and other streaming services.;https://tv.apple.com;Streaming Media
10986;app.pushly;Pushly;Pushly;Pushly is a platform designed to enhance audience engagement through push notifications. Its use of push notifications turns one-time visitors into loyal subscribers;https://www.pushly.com/;Advertiser
10987;app.resonate;Resonate;Resonate;The Resonate platform is a marketing and advertising solution.  The platform translates deep insights about people's values, preferences, and beliefs into more relevant marketing and advertising.;https://www.resonate.com;Advertiser
10988;app.rakuten;Rakuten;Rakuten;Rakuten.com is an e-commerce marketplace platform.  It offers cash back, special deals and shopping rewards on a large selection of products and services.;https://www.rakuten.com;Shopping
10989;app.kohls;Kohl's;Kohl's;Kohl’s operates family-oriented department stores that sell apparel, footwear and accessories.;https://www.kohls.com;Shopping
10990;app.evernote;Evernote;Evernote;Evernote is a powerful tool that can help executives, entrepreneurs and creative people capture and arrange their ideas.;https://evernote.com;Business
10991;app.teamspeak;TeamSpeak;TeamSpeak;TeamSpeak is a proprietary voice-over-Internet Protocol (VoIP) application for audio communication between users on a chat channel.  The app is popular in the gaming community.;https://teamspeak.com/;VoIP/Conferencing
10992;app.kwai;Kwai;Kwai;Kwai is a social network for short videos and trends developed by Beijing Kuaishou Technology.  It has similar functionality to TikTok and has strong user base in Asia and South America.;http://kwai.com;Social Media
10993;app.news-corp;News Corp;News Corporation;News Corp is a media and publishing company operating across digital real estate information, news media, book publishing, and cable television. Its notable assets include Dow Jones & Company, News UK, News Corp Australia, and more.;https://newscorp.com;Business
10994;app.fox-corporation;Fox Corporation;Fox Corporation;Fox Corporation is a mass media that deals primarily in the television broadcast, news, and sports broadcasting industries.  Brands include: Fox, Fox TV, Fox News, Fox Sports and Tubi.;https://www.foxcorporation.com;Arts and Entertainment
10995;app.fox-broadcasting;Fox;Fox Broadcasting Company;Fox Broadasting Company (Fox) is a commercial broadcast television network owned by Fox Corporation.  Fox mostly operates in the United States and has a small international market.;https://www.fox.com;Arts and Entertainment
10996;app.signifyd;Signifyd;Signifyd;Signifyd’s ecommerce fraud protection platform provides three services for companies: revenue protection, abuse prevention, and payment compliance.;http://signifyd.com;Cybersecurity
10997;app.adp;ADP;Automatic Data Processing;ADP offers online payroll and human resources (HR) solutions, plus tax, compliance, benefit administration and more.;https://www.adp.com;Financial
10998;app.fidelity;Fidelity;Fidelity;Fidelity is a privately-owned investment manager focusing on a diverse set of customers. It also provides IRAs, 401(k) rollovers, annuities, discount brokerage services, retirement services, estate planning, and more.;https://www.fidelity.com;Financial
10999;app.acast;Acast;Acast;Acast is a Swedish-founded company that provides hosting, monetization and growth support to podcasts.;https://acast.com;Streaming Media
11000;app.bose;Bose;Bose;Bose is is a research company that develops sound solutions for entertainment, home audio, aviation, and automotive industries - headphones, speakers, wearables, wellness products, and more;https://www.bose.com;Device/IoT
11001;app.macys;Macy's;Macy's;Macy's is an American department store that offers consumers high-quality clothing at reasonable costs.;http://www.macys.com;Shopping
11002;app.iponweb;IPONWEB;IPONWEB;IPONWEB is an AI, data & engineering company that specialises in programmatic and real-time advertising technology and infrastructure.;https://www.iponweb.com;Advertiser
11003;app.cogocast;CogoCast;CogoCast;CogoCast is the display advertising platform for  Cogo Labs - a startup incubator and accelerator.;https://www.cogocast.com;Advertiser
11004;app.adroll;AdRoll;AdRoll;AdRoll is a brand and marketing company that provides audience targeting, cross-channel engagement, advanced measurement and attribution.;https://www.adroll.com;Advertiser
11005;app.automattic;Automattic;Automattic;Automattic develops publishing platforms for users and small businesses.  Platforms include Wordpress, Tumblr, Gravatar, WooCommerce, and more.;https://automattic.com;Hosting
11006;app.oracle-cloud;Oracle Cloud;Oracle Cloud;Oracle Cloud is an open, flexible, enterprise-grade cloud computing platform similar to Amazon AWS and Microsoft Azure.;https://www.oracle.com/cloud;Hosting
11007;app.monday-com;monday.com;monday.com;monday.com Work OS is an open platform where anyone can create the tools they need to run every aspect of their work.;https://monday.com;Business
11008;app.crowdstrike;CrowdStrike;CrowdStrike;CrowdStrike offers a cloud-native cybersecurity platform that stops breaches and secures businesses of all shapes and sizes.;https://www.crowdstrike.com;Cybersecurity
11009;app.amazon-s3;Amazon S3;Amazon S3;Amazon S3 is cloud object storage with scalability, data availability, security, and performance. S3 is ideal for data lakes, mobile applications, backup and restore, archival, IoT devices, ML, AI, and analytics.;https://aws.amazon.com/s3;Hosting
11010;app.google-hosted;Google Hosted;Google Hosted;Google Hosted is the hosting platform for users and companies - it includes user content on Google Workspace, Google Sites, and Google Storage.;https://workspace.google.com/;Hosting
11011;app.azure-front-door;Azure Front Door;Azure Front Door;Azure Front Door is an anycast-based content delivery network (CDN) that is part of the Microsoft cloud computing platform.;https://azure.microsoft.com/en-us/services/frontdoor/;CDN
11012;app.google-platform;Google Platform;Google Platform;The Google Platform is a network that provides computing and infrastructure for various Google applications an technology partners: Google Search, Gmail and more.;http://www.google.com;Business
11013;app.amazon-platform;Amazon Platform;Amazon Platform;The Amazon Platform is a network that provides computing and infrastructure for Amazon's online store, consumer electronic products, selected technology partners, and more.;https://www.amazon.com;Business
11014;app.oracle-platform;Oracle Platform;Oracle Platform;The Oracle Platform is a network that provides computing and infrastructure for Oracle's applications: MySQL, VirtualBox, and more.;https://www.oracle.com/index.html;Business
11015;app.sydney-morning-herald;Sydney Morning Herald;Sydney Morning Herald;The Sydney Morning Herald is a daily newspaper published in Sydney, Australia.  The Herald is the oldest continuously published newspaper in Australia and the most widely-read masthead in the country.;https://www.smh.com.au;News
11016;app.anyclip;AnyClip;AnyClip;AnyClip is a video analytics platform that provides media companies with tools to analyze and catalog their video libraries.;https://anyclip.com;Business
11017;app.flixmedia;Flixmedia;Flixmedia;Flixmedia consolidates digital online content for marketers and advertisers to ensure seamless brand consistency across international regions.;https://www.flixmedia.com;Advertiser
11018;app.workplace;Workplace;Workplace;Workplace is an online collaborative software tool developed by Meta Platforms (Facebook). It facilitates online groupwork, instant messaging, video conferencing, and news sharing.;https://www.workplace.com;Business
11019;app.vudu;Vudu;Vudu;Vudu is an American digital video store and streaming service owned by Fandango Media, a joint-venture between NBCUniversal and WarnerMedia.;https://www.vudu.com;Streaming Media
11020;app.samsung-push;Samsung Push;Samsung Push;Samsung Push is a platform notification service created by Samsung.  It is used to send messages to mobile phones, tablets and other Samsung devices.;http://www.samsungosp.com/;Messaging
11021;app.hma;HMA;HideMyAss;HMA (formerly HideMyAss!) is a VPN service founded in 2005 in the United Kingdom. It has been a subsidiary of the Czech cybersecurity company Avast since 2016.;https://www.hidemyass.com/;VPN and Proxy
11022;app.windows;Windows;Windows;Microsoft Windows, commonly referred to as Windows, is a group of several proprietary graphical operating system families, all of which are developed and marketed by Microsoft. Each family caters to a certain sector of the computing industry;https://www.windows.com/;OS/Software Updates
11023;app.crazy-egg;Crazy Egg;Crazy Egg;Crazy Egg allows website owners to create tests to figure out what people are doing on their website. The company's Confetti and Heatmap features allow users to visually understand user behavior.;https://crazyegg.com/;Advertiser
11024;app.sovrn;Sovrn;Sovrn;Sovrn offers products and services to online publishers that help them understand, operate and grow their businesses.;https://www.sovrn.com;Advertiser
11025;app.binance;Binance;Binance;Binance is one of the world's largest bitcoin exchanges.   The company was initially based in China, but is now located in small offshore jurisdictions.;https://www.binance.com/;Financial
11026;app.marriott;Marriott;Marriott;Marriott International operates, franchises, and licenses lodging including hotel, residential, and timeshare properties.;https://www.marriott.com;Recreation
11027;app.visualstudio;Visual Studio;Visual Studio;Microsoft Visual Studio is an integrated development environment from Microsoft. It is used to develop computer programs, as well as websites, web apps, web services and mobile apps.;https://visualstudio.microsoft.com;Business
11028;app.the-guardian;The Guardian;The Guardian;The Guardian is an influential daily newspaper published in London.  It is generally considered one of the United Kingdom's leading newspapers.;https://www.theguardian.com/;News
11029;app.exoclick;ExoClick;ExoClick;ExoClick is a global online advertising network providing services to advertisers and publishers. The company runs geo-targeted ads daily via their ad network and ad exchange.;https://www.exoclick.com;Advertiser
11030;app.cox;Cox;Cox Communications;Cox Communications is an American digital cable television provider for the home as well as offering residential and business telecommunication and security services.;https://www.cox.com;ISP/Telco
11031;app.behance;Behance;Behance;Behance is a social media platform owned by Adobe to showcase and discover creative work. Members create multi-media portfolios that showcase their work within the social network.;https://www.behance.net;Business
11032;app.statcounter;Statcounter;Statcounter;StatCounter is a web analytics service that helps companies track, analyze and understand visitors so companies can make better marketing decisions.;https://statcounter.com;Advertiser
11033;app.adguard;AdGuard;AdGuard;Adguard develops a range of software products for internet filtering. Its products provide web security, privacy protection, and ad-blocking protection.;https://adguard.com/;Cybersecurity
11034;app.quad9;Quad9;Quad9;Quad9 is a global public recursive DNS resolver that aims to protect users from malware and phishing.;https://quad9.net;Cybersecurity
11035;app.traffic-factory;Traffic Factory;Traffic Factory;Traffic Factory is an advertising network with real-time bidding and monetization for different audiences.  The company is a broker between advertisers and publishers.;https://www.trafficfactory.com;Advertiser
11036;app.privateinternetaccess;PIA VPN;Private Interner Access;PIA VPN is a VPN service with an emphasis on online privacy, security, open source code and freedoms.;https://www.privateinternetaccess.com;VPN and Proxy
11037;app.6sense;6sense;6sense;6sense is an Account Engagement Platform that provides clients with data and analysis on customer purchasing decisions.;https://6sense.com;Advertiser
11038;app.edgecast;Edgecast;Edgecast;Edgecast (formerly Verizon Digital Media Services) provides video streaming, content delivery and cloud security.  The company was acquired by Yahoo, and later spun off into Edgio.;https://www.edgecast.com;CDN
11039;app.afterpay;Afterpay;Afterpay;Afterpay provides merchants the ability to allow shoppers to receive products immediately and pay in four simple installments over a short period of time.;https://www.afterpay.com;Financial
11040;app.emirates;Emirates;Emirates;Emirates is a large airline that operates out of the United Arab Emirates.  The company offers both passenger and freight services.;https://www.emirates.com/;Business
11041;app.splashtop;Splashtop;Splashtop;Splashtop is a family of remote desktop software and remote support software.  The solution enables users to remotely access or remotely support computers from desktop and mobile devices.;https://www.splashtop.com/;Remote Desktop
11042;app.snowflake;Snowflake;Snowflake;Cloud-based, data warehousing platform that allows customers to unify, integrate, analyze, and share previously siloed data.;https://www.snowflake.com;Technology
11043;app.gong-io;Gong;Gong;Gong analyzes customer-facing interactions across phone, email, and web conferencing to deliver marketing insights.;https://www.gong.io;Advertiser
11044;app.userreport;UserReport;UserReport;UserReport is a set of free, easy-to-use tools, that allows businesses to gain knowledge about customer gender, age, income, and more.;https://www.userreport.com;Advertiser
11045;app.figma;Figma;Figma;Figma allows teams to build better products through design, prototype, and feedback - all in one place.;https://www.figma.com;Business
11046;app.lacework;Lacework;Lacework;Lacework provides end-to-end cloud security automation for AWS, Azure, and GCP cloud workloads and containers.;https://www.lacework.com;Cybersecurity
11047;app.workramp;WorkRamp;WorkRamp;WorkRamp is a learning management system assisting customers to train their employees, partners, and customers.;https://www.workramp.com;Business
11048;app.acuityads;AcuityAds;AcuityAds;AcuityAds provides marketers a solution for omnichannel digital advertising with best-of-category return on advertising spend;https://www.acuityads.com;Advertiser
11049;app.prisma;Prisma;Prisma;Prisma is a Node.js and TypeScript Object-Relational Mapping (ORM) that can be used to build GraphQL servers, REST APIs, microservices, and more.;https://www.prisma.io;Technology
11050;app.kandji;Kandji;Kandji;Kandji is a modern Apple device management solution for macOS, iOS, iPadOS, and tvOS.;https://www.kandji.io;Business
11051;app.harness-io;Harness.io;Harness.io;Harness is a self-service CI/CD platform that allows engineers and DevOps to build, test, deploy, and verify software, on-demand.;https://harness.io;Technology
11052;app.g2;G2;G2;G2 operates a software marketplace for business organizations to research, buy, and manage their software and services.;https://www.g2.com;Business
11053;app.y-combinator;Y Combinator;Y Combinator;Y Combinator provides funding for early stage startups.;https://www.ycombinator.com;Business
11054;app.woodynet;WoodyNet;WoodyNet;WoodyNet is a leading DNS anycast and DNSSEC key management vendor.  The company provides the domain name infrastructure for many governments and technology companies around the wolrd.;https://woodynet.net;Business
11055;app.netnod;Netnod;Netnod Internet Exchange;Netnod Internet Exchange is a nonprofit organization based in Stockholm, Sweden, that operates Internet exchange points and manages one of the thirteen root name servers for the Domain Name System;https://www.netnod.se;Technology
11056;app.cogent;Cogent;Cogent Communications;Cogent Communications is a multinational internet service provider based in the US. The company's primary services consist of Internet access and data transport, offered on a fiber optic, IP data-only network, along with colocation in data centers.;https://www.cogentco.com/;Hosting
11057;app.nasa;NASA;National Aeronautics and Space Administration;NASA is an independent agency of the U.S. federal government responsible for the civilian space program, as well as aeronautics and space research;https://www.nasa.gov;Government
11058;app.icann;ICANN;Internet Corporation for Assigned Names and Numbers;ICANN is a nonprofit organization responsible for coordinating the maintenance and procedures of several databases related to the namespaces and numerical spaces of the Internet;https://www.icann.org;Technology
11059;app.china-unicom;China Unicom;China Unicom;China Unicom provides broadband communications, information services, mobile data services, and data and internet application services through its subsidiaries;https://www.chinaunicomglobal.com;ISP/Telco
11060;app.aptum;Aptum;Aptum;Aptum is a global hybrid multi-cloud managed service provider. We deliver complex solutions across a fully-managed, high-performance network.;https://aptum.com;Hosting
11061;app.alibaba-cdn;Alibaba CDN;Alibaba CDN;Alibaba CDN is a content delivery network services company that is part of the Alibaba Cloud solution.  The company provides video, image, software and other file delivery to locations around the globe.;https://www.alibabacloud.com/product/cdn;CDN
11062;app.ihs-markit;IHS Markit;IHS Markit;IHS provides information and analysis to support the decision-making process of businesses and governments in regard to various industries.;https://ihsmarkit.com/;Financial
11063;app.retn;RETN;RETN;RETN is an independent Eurasian provider of IP transit and network services, with a unique capability to connect Europe and Asia.;https://retn.net;Hosting
11064;app.spectrio;Spectrio;Spectrio;Spectrio is a provider of customer engagement solutions ranging from digital signage, interactive kiosks, wifi marketing, and more.;http://spectrio.com;Advertiser
11065;app.observability;Observe;Observe;Observe is a SaaS solution in information technology that involves monitoring apps and helping to identify the root cause of any issues.;https://www.observeinc.com;Technology
11066;app.kakao-corp;Kakao Corporation;Kakao Corporation;Kakao is a South Korean Internet conglomerate that provides products across a wide range of industries.  Products include Daum, KakaoTalk, KakaoPay, and others.;https://www.kakaocorp.com/;Business
11067;app.discourse;Discourse;Discourse;Discourse is modern forum software for businesses and communities.  It can be used as a mailing list, discussion forum, long-form chat room, and more.;https://www.discourse.org;Social Media
11068;app.auth0;Auth0;Auth0;Auth0 is an identity management platform for web, mobile, IoT, and internal applications. The company's products make it possible to rapidly integrate into existing systems.;https://auth0.com;Cybersecurity
11069;app.hurricane-electric;Hurricane Electric;Hurricane Electric;Hurricane Electric is a global Internet service provider offering internet transit, tools, and network applications, as well as data center colocation and hosting services.;https://he.net;Hosting
11070;app.mailgun;Mailgun;Mailgun;Mailgun enables developers to tightly integrate mail services into third party applications.  Capabilities include sending, receiving, and tracking.;https://www.mailgun.com/;Mail
11071;app.baishancloud;BaishanCloud;BaishanCloud;BaishanCloud fully integrates low-latency network, zero-trust security, and edge computing capabilities in its globally distributed edge cloud platform.;https://intl.baishancloud.com;CDN
11072;app.china-mobile;China Mobile;China Mobile;China Mobile Limited provides mobile voice, mobile data, wireline broadband, and other information and communications services.;https://www.chinamobileltd.com;ISP/Telco
11073;app.kingsoft-cloud;Kingsoft Cloud;Kingsoft Cloud;Kingsoft Cloud is a technology platform for businesses and developers, providing online cloud storage and cloud distribution services.;https://www.ksyun.com;Hosting
11074;app.lazada;Lazada;Lazada;Lazada is an online shopping and selling platform in Southeast Asia – present in Indonesia, Malaysia, the Philippines, Singapore, Thailand, and Vietnam.;https://www.lazada.com/;Shopping
