id;tag;short_name;full_name;description;url;category
10626;app.irs-usa;IRS;Internal Revenue Service;The Internal Revenue Service (IRS) is a U.S. government agency responsible for the collection of taxes and enforcement of tax laws.;https://www.irs.gov;Government
10627;app.bitmoji;Bitmoji;Bitmoji;Bitmoji is a secondary social media app that people use to create little cartoon versions of themselves, which they then use on their various social media accounts.;https://www.bitmoji.com;Social Media
10628;app.proxmox;Proxmox;Proxmox;Proxmox develops the open-source virtualization platform Proxmox VE and the Proxmox Mail Gateway, an open-source email security solution to protect your mail server.;https://proxmox.com;OS/Software Updates
10629;app.proxmox-updates;Proxmox Updates;Proxmox Updates;Proxmox develops the open-source virtualization platform Proxmox VE and the Proxmox Mail Gateway, an open-source email security solution to protect your mail server.   This application tracks software updates.;https://proxmox.com;OS/Software Updates
10630;app.turnkeylinux;Turnkey Linux;Turnkey Linux;Turnkey Linux is a free Debian based library of system images that pre-integrates and polishes the best free software components into secure, easy to use solutions.;https://www.turnkeylinux.org;OS/Software Updates
10631;app.axios;Axios;Axios;Axios is an American news website.  Articles are typically brief and matter-of-fact: most are shorter than 300 words and use bullet points so they are easier to scan.;https://www.axios.com;News
10632;app.forge-of-empires;Forge of Empires;Forge of Empires;Forge of Empires is a browser based strategy game.   In the game, players control the fate of their city throughout different historical periods.;https://forgeofempires.com/;Games
10633;app.siriusxm;SiriusXM;SiriusXM;Sirius XM Radio is an American-based satellite radio broadcasting company providing satellite radio and online radio services.;https://www.siriusxm.com;Arts and Entertainment
10634;app.toshiba;Toshiba;Toshiba;Toshiba provides innovative and cost efficient business to business solutions for multiple industries servicing the industrial, power and energy, and retail verticals.;https://www.toshiba.com;Business
10635;app.forter;Forter;Forter;Forter offers fraud prevention and protection with real-time automated decisions for all transactions.;https://www.forter.com;Cybersecurity
10636;app.jw-player;JW Player;JW Player;JW Player offers an advanced and flexible media player for publishing videos, running video ads, and streaming web content.;https://www.jwplayer.com;Advertiser
10637;app.khan-academy;Khan Academy;Khan Academy;Khan Academy is a nonprofit with the mission of providing a free, world-class education for anyone, anywhere.;https://www.khanacademy.org;Career and Education
10638;app.miui;MIUI OS;MIUI OS;MIUI is  a heavily modified software skin for Android developed by Chinese electronics manufacturer Xiaomi.  It is a fork of the Android operating system.;https://home.miui.com;Device/IoT
10639;app.zscaler;Zscaler;Zscaler;Zscaler is enabling secure digital transformation by rethinking traditional network security, and empowering enterprises to securely work from anywhere.;https://www.zscaler.com;VPN and Proxy
10640;app.viasat;ViaSat;ViaSat;ViaSat produces satellite and other digital communication products that enable fast, secure, and efficient communications to any location.;https://www.viasat.com;ISP/Telco
10641;app.inmarsat;Inmarsat;Inmarsat;Inmarsat is a world leader in global, mobile satellite communications, delivering reliable, seamless connectivity.;https://www.inmarsat.com/;ISP/Telco
10642;app.starlink;Starlink;Starlink;Starlink offers satellite internet and broadband internet services for customers.  The company provides low latency, broadband internet system to meet the needs of consumers across the globe.;https://www.starlink.com;Business
10643;app.hughesnet;HughesNet;HughesNet;Hughes Network Systems is a high-speed satellite Internet company that serves rural and coastal areas.;https://www.hughesnet.com;ISP/Telco
10644;app.bluejeans;Blue Jeans Network;Blue Jeans Network;BlueJeans is a cloud video conferencing. The product can be used to securely hold live video calls, webinars, conference calls, and online meetings.;https://www.bluejeans.com;VoIP/Conferencing
10645;app.robinhood;Robinhood;Robinhood Stock Trading;Commission-free investing, plus the tools you need to put your money in motion. Sign up and get your first stock for free. Certain limitations and fees may apply. View Robinhood Financial’s fee schedule at rbnhd.co/fees to learn more.;https://robinhood.com/us/en;Financial
10646;app.cyberghostvpn;CyberGhost VPN;CyberGhost VPN and Proxy;Founded in 2011 in Bucharest, Romania, CyberGhost provides VPN privacy and security solutions. The company secures and anonymizes the online presence of over 30 million users across the globe.;https://www.cyberghostvpn.com;VPN and Proxy
10647;app.vyos;VyOS;VyOS;VyOS is an open source network operating system for network devices: VPN gateway, edge router, IoT gateway, border router and more.;https://vyos.io;OS/Software Updates
10648;app.mitsubishi-electric;Mitsubishi Electric;Mitsubishi Electric;MELCloud (Mitsubishi Electric) provides complete flexibility for controlling several Mitsubishi Electric air conditioning, heating, ventilation, and other appliances.;http://melcloud.com;Device/IoT
10649;app.britepool;BritePool;BritePool;BritePool is an identity resolution and identity verification service for advertisers and publishers.   The company offers solutions to track users without cookies.;https://www.britepool.com;Advertiser
10650;app.ahnlab;AhnLab;AhnLab;AhnLab is a cloud security technology provider that develops information security solutions and services for consumers, enterprises, and more.;http://global.ahnlab.com;Cybersecurity
10651;app.lg-uplus;LG Uplus;LG Uplus;LG Uplus Corp is a South Korean telecommunications and mobile phone operator controlled by the LG Group, one of the country's largest companies. It was formerly known as LG Telecom.;http://uplus.co.kr;ISP/Telco
10652;app.xvideos;XVideos;XVideos;XVideos is a pornographic video sharing and viewing website.  XVideos serves as a pornographic media aggregator, a type of website which gives access to adult content in a similar manner as YouTube does for general content.;http://www.xvideos.com;Adult
10653;app.reflected-networks;Reflected Networks;Reflected Networks;Reflected Networks a managed hosting and custom hosting solutions provider.;https://reflected.net;Hosting
10654;app.carbonite;Carbonite;Carbonite;Carbonite is a provider of cloud, backup and hybrid business continuity solutions for small and mid-sized businesses.  The company purchased Evault in 2015.;https://www.carbonite.com/;Business
10655;app.anydesk;AnyDesk;AnyDesk;AnyDesk is a proprietary remote desktop application that provides platform independent remote access to personal computers and other devices running the host application.;https://anydesk.com/;Remote Desktop
10656;app.simplemining;SimpleMining;SimpleMining;SimpleMining OS (SMOS) is an easy-to-use plug and play platform for cryptocurrency GPU mining.  Systems can be managed through a central cloud dashboard.;https://simplemining.net;Financial
10657;app.pdq;PDQ.com;PDQ.com;PDQ provides software deployment and patch management process tools.  The solution allows system administrators to spend less time manually patching and updating machines, and more time solving user problems.;https://www.pdq.com;Business
10658;app.ethermine;Ethermine;Ethermine;Ethermine provides high-performance cryptocurrency mining pools with servers located in Europe, Asia and North America.;https://ethermine.org;Financial
10659;app.flypool-beam;Flypool BEAM;Flypool BEAM;Flypool BEAM provides high-performance cryptocurrency mining pools with servers located in Europe, Asia and North America.;https://beam.flypool.org;Financial
10660;app.flypool-zcash;Flypool Zcash;Flypool Zcash;Flypool Zcash provides high-performance cryptocurrency mining pools with servers located in Europe, Asia and North America.;https://zcash.flypool.org;Financial
10661;app.flypool-ycash;Flypool Ycash;Flypool Ycash;Flypool Ycash provides high-performance cryptocurrency mining pools with servers located in Europe, Asia and North America.;https://ycash.flypool.org;Financial
10662;app.flypool-ravencoin;Flypool Ravencoin;Flypool Ravencoin;Flypool Ravencoin provides high-performance cryptocurrency mining pools with servers located in Europe, Asia and North America.;https://ravencoin.flypool.org;Financial
10663;app.torrent-eu-org;torrent.eu.org;torrent.eu.org;torrent.eu.org is an open BitTorrent tracker - a network helper to provide file sharing over peer-to-peer networking.;http://www.torrent.eu.org;File Sharing
10664;app.domotz;Domotz;Domotz;Domotz offers remote home and network monitoring.  Features include device access, SNMP monitoring, network diagnostics, remote power management, device alerts, and more.;https://www.domotz.com;Business
10665;app.activision-blizzard;Activision Blizzard;Activision Blizzard;Activision Blizzard is an interactive games holding company.  The company currently includes five business units: Activision Publishing, Blizzard Entertainment, King, Major League Gaming, and Activision Blizzard Studios.;https://www.activision.com;Games
10666;app.ark-game;Ark Game;Ark Game;Ark is an ecosystem of games produced by Studio Wildcard.  The game is played from either a third-person or first-person perspective and its open world is navigated on foot or by riding a prehistoric animal.;http://playark.com/;Games
10667;app.bittorrent;BitTorrent Client;BitTorrent Client;BitTorrent is the company behind the largest decentralized P2P communications protocol for distributing data and large files over the Internet.;https://www.bittorrent.com/;File Sharing
10668;app.tunnelbear;TunnelBear;TunnelBear;Tunnelbear is a two-switch VPN service that allows its users to access content across the world. It enables users to access location-restricted sites in specific countries.;https://www.tunnelbear.com;VPN and Proxy
10669;app.snort;Snort;Snort;Snort is an open-source, free and lightweight network intrusion detection system (NIDS) software for Linux and Windows to detect emerging threats.;https://snort.org;Cybersecurity
10670;app.dyn;Dyn;Dyn;Dyn is a pioneer in managed DNS and in cloud-based infrastructure that connects users with digital content and experiences across the internet.;https://account.dyn.com/;Technology
10671;app.okcupid;OkCupid;OkCupid;OkCupid is an online dating website that uses quizzes and multiple-choice questions to find a match for the user.;https://www.okcupid.com;Social Media
10672;app.instructure;Instructure;Instructure;Instructure is a technology company that is focused on providing cloud-based learning management software for educational institutions, companies and other organizations.;https://www.instructure.com;Career and Education
10673;app.zillow;Zillow;Zillow;Zillow is an online real estate marketplace for finding and sharing information about homes, real estate, and mortgages.;https://www.zillow.com;Financial
10674;app.etsy;Etsy;Etsy;Etsy is an e-commerce site and a mobile app for buying and selling handmade and vintage items. Users can find products in the categories of clothing and accessories, jewelry, craft supplies and tools, and more.;https://www.etsy.com;Shopping
10675;app.freeip;FreeIP;FreeIP;FreeIP is a tool for remote viewing cameras and other on-premise systems.  The software allows you to watch live streaming audio and video of your security cameras in real time.;https://www.freeip.com;Device/IoT
10676;app.virtualbox;VirtualBox;VirtualBox;VirtualBox is open-source software for virtualizing the PC computing architecture. It acts as a hypervisor, creating a virtual machine where the user can run another operating system.;https://www.virtualbox.org;OS/Software Updates
10677;app.asustor;ASUSTOR;ASUSTOR;ASUSTOR is a provider of private cloud storage (network attached storage) and video surveillance (network video recorder) solutions.;https://www.asustor.com;Device/IoT
10678;app.changeip;ChangeIP;ChangeIP;ChangeIP is a free Dynamic DNS service that delivers the essential DNS features including a free-to-use subdomain, unlimited URL redirections, and complete port redirection capabilities.;http://www.changeip.com;Technology
10679;app.samsung-ads;Samsung Ads;Samsung Ads;Samsung TVs and other devices display advertisements on customer-owned devices.  Automated Content Recognition (ACR) technology is used to detect viewing behavior.  Includes AdGear acquisition.;https://www.samsung.com;Advertiser
10680;app.tealium;Tealium;Tealium;Tealium is a provider of customer data orchestration tools aimed to address challenges in online search, analytics, marketing, and segment targeting.;https://tealium.com;Advertiser
10681;app.clearphone;ClearPHONE;ClearPHONE;ClearPHONE is a new type of privacy-first smartphone that runs Android apps but also gives consumers total control over their internet experience by blocking ads, cookies, trackers, behavior profiling, phishing, viruses, spyware, malware.;https://www.clearunited.com/phone;Device/IoT
10682;app.popads-net;PopAds;PopAds;PopAds.net is a potential adware site. The domain belongs to the Costa Rica-based advertising company Tomksoft S.A. The site PopAds.net may be attached to your browser without your knowledge.;https://www.popads.net;Advertiser
10683;app.surfshark;Surfshark;Surfshark;Surfshark is a virtual private network (VPN) service provider that offers products such as a virtual private network service, a data leak detection system, and a private search tool.;https://surfshark.com;VPN and Proxy
10684;app.miwifi;MiWiFi;MiWiFi;MiWiFi is a WiFi router developed by Xiaomi.   Their routers allow for creating mesh networks of wireline, wireless, or gigabit Ethernet networks.;http://miwifi.com;Device/IoT
10685;app.flighthub;FlightHub;FlightHub;Cheap Flights is what FlightHub.com is all about. Save big on airfare, airline tickets and hotels. A great way to get cheap deals.;https://www.flighthub.com;Shopping
10686;app.seagate;Seagate;Seagate;Seagate provides cloud storage services, systems, hard drives, solid state drives, and end-to-end data management solutions.;https://www.seagate.com;Business
10687;app.stream-io;Stream;Stream;Stream is an enterprise-grade chat and activity feed provider.  Their products include client-side SDKs for iOS, Android, React, React Native, Flutter, and support for the most commonly used server-side languages.;https://getstream.io;Messaging
10688;app.red-hat;Red Hat;Red Hat;Red Hat is a provider of enterprise open source solutions, including high-performing Linux, cloud, container, and Kubernetes technologies.;https://www.redhat.com;OS/Software Updates
10689;app.ibm-cloud;IBM Cloud;IBM Cloud;IBM Cloud provides infrastructure as a service (IaaS), software as a service (SaaS) and platform as a service (PaaS) offered through public, private and hybrid cloud delivery models.;https://cloud.ibm.com;Hosting
10690;app.neustar;Neustar;Neustar;Neustar is a technology company that provides real-time information and analytics for the Internet, risk, digital performance, and defense, telecommunications, entertainment, and marketing.;https://www.home.neustar;Business
10691;app.badoo;Badoo;Badoo;Badoo is a dating-focused social network, allowing users to chat, make friends and share interests.;https://badoo.com;Social Media
10692;app.kali-linux;Kali Linux;Kali Linux;Kali Linux is an open-source, Debian-based Linux distribution geared towards various information security tasks, such as penetration testing, security research, and computer forensics.;https://kali.org;Cybersecurity
10693;app.keycdn;KeyCDN;KeyCDN;KeyCDN is a high-performance content delivery network (CDN). Their global network delivers any digital content, such as a website, software, or game, at faster speeds.  The parent company is Proinity.;https://www.keycdn.com;CDN
10694;app.big-fish-games;Big Fish Games;Big Fish Games;Big Fish Games is a developer and distributor of casual games for computers and mobile devices.   Games include Dark Flight, Fairway Solitaire, Hidden Expedition, and more.;https://www.bigfishgames.com;Games
10695;app.applovin;AppLovin;AppLovin;AppLovin is a global technology platform that provides developers an integrated set of solutions to grow their businesses.  The solution enables developers of all sizes to market, monetize, analyze and publish their apps;https://www.applovin.com;Advertiser
10696;app.vungle;Vungle;Vungle;Vungle is an in-app video platform for marketers. Advertisers depend on Vungle's creative optimization technologies, targeting, and HD video ad delivery to reach and acquire high-value users worldwide;https://vungle.com;Advertiser
10697;app.gog-com;GOG.com;Good Old Games;GOG.com is a digital distribution platform for video games and films.  The company delivers DRM-free video games through its digital platform for Microsoft Windows, macOS and Linux.;https://www.gog.com;Games
10698;app.goto;GoTo;GoTo;GoTo is a unified communication platform that includes video conferencing, webinar and phone system solutions.  GoTo acquired Jive Communications (now GoToConnect) and is a subsidiary of LogMeIn.;https://www.goto.com;Business
10699;app.remotepc;RemotePC;RemotePC;RemotePC provides remote access and desktop solutions for PC, Mac and Linux.;https://www.remotepc.com;Remote Desktop
10700;app.thunderbird;Thunderbird;Thunderbird;Thunderbird is a free email application from the team that developed FireFox. Multiple features, such as built-in Do-Not-Track and remote content blocking, work together to ensure your safety and privacy.;https://www.thunderbird.net;Mail
10701;app.jsdelivr;jsDelivr;jsDelivr;jsDelivr is an app delivery platform that provides mirrors for npm, GitHub, WordPress plugins, and custom endpoints for several other projects with special requirements.;https://www.jsdelivr.com;Business
10702;app.icq;ICQ;ICQ;ICQ is a cross-platform messenger and VoIP client. The name ICQ derives from the English phrase "I Seek You".   The software was popular in the early 2000s and is still in use today.;https://icq.com;Messaging
10703;app.somafm;SomaFM;SomaFM;Listener-supported, commercial-free internet-only radio station.;https://somafm.com;Streaming Media
10704;app.shodan;Shodan;Shodan;Shodan is an IoT search engine.  IT has servers located around the world that crawl the Internet 24/7 to provide the latest Internet intelligence.;https://www.shodan.io;Cybersecurity
10705;app.google-authentication;Google Auth;Google Auth;Google offers single sign-on (SSO) for its various products and services, along with third-party websites.  Users can authenticate to apps and services using their Google account.;https://accounts.google.com/;Business
10706;app.apple-id;Apple ID;Apple ID;Apple offers single sign-on (SSO) for its various products and services, along with third-party websites.  Users can authenticate to apps and services using their Apple ID.;https://appleid.apple.com;Business
10707;app.microsoft-authentication;Microsoft Auth;Microsoft Auth;Microsoft offers single sign-on (SSO) for its various products and services, along with third-party websites.  Users can authenticate to apps and services using their Microsoft account.;https://login.live.com;Business
10708;app.dailymotion;Dailymotion;Dailymotion;Dailymotion is a French video-sharing technology platform primarily owned by Vivendi.  North American launch partners included BBC News, Vice Media, Bloomberg, and Hearst Digital Media.;https://www.dailymotion.com;Streaming Media
10709;app.spacex;SpaceX;SpaceX;SpaceX designs, manufactures and launches advanced rockets and spacecraft. The company was founded in 2002 to revolutionize space technology, with the ultimate goal of enabling people to live on other planets.;https://www.spacex.com;Business
10710;app.ticketmaster;Ticketmaster;Ticketmaster;Ticketmaster is a ticket marketplace in live event ticketing products and services. The company is the official ticketing partner of the NHL, NFL, NBA, USTA, PGA Tours, a number of MLB and MLS teams, and artists and venues around the world.;https://www.ticketmaster.com;Shopping
10711;app.conde-nast;Conde Nast;Conde Nast;Condé Nast is a global media company that is home to some of the world’s leading brands including Vogue, GQ, The New Yorker, Vanity Fair, Wired and Architectural Digest (AD), Condé Nast Traveler and La Cucina Italiana.;https://www.condenast.com;Arts and Entertainment
10712;app.lumen-cdn;Lumen CDN;Lumen CDN;Lumen Technologies (was CenturyLink/Level3) is an IT company that integrates network infrastructure, cloud connectivity, security and enterprise-class services.  Lumen CDN has been merged with the Lumen app.;https://www.lumen.com/help/en-us/cdn.html;CDN
10713;app.clevertap;CleverTap;CleverTap;CleverTap is a SaaS-based customer lifecycle management and mobile marketing company that provides mobile app analytics and user engagement products.;https://clevertap.com;Advertiser
10714;app.unruly-group;Unruly;Unruly;Unruly is a London-based advertising technology company that gets videos watched, tracked, and shared across the Open Web.  The app definition is now part of the RhythmOne platform.;https://unruly.co;Advertiser
10715;app.appcues;Appcues;Appcues;Appcues provides a no-code platform that empowers non-technical teams to track and analyze product usage. The product can be used for product usage stats, onboarding tours, announcements, and surveys.;https://www.appcues.com;Advertiser
10716;app.walkme;WalkMe;WalkMe;WalkMe enables organizations and advertisers to measure, drive, and act to maximize the impact of their digital ecosystem and accelerate the return on their software investment.;https://www.walkme.com;Advertiser
10717;app.launchdarkly;LaunchDarkly;LaunchDarkly;LaunchDarkly provides simple, scalable feature flag and toggle management (feature management) for the modern enterprise. The software is used to help teams build better software.;https://launchdarkly.com;Business
10718;app.heroku;Heroku;Heroku;Heroku is a platform as a service (PaaS) that enables developers to build, run, and operate applications entirely in the cloud.;https://www.heroku.com;Hosting
10719;app.redtube;Redtube;Redtube;Redtube is a pornographic website allowing users to watch, share and upload video and audio files.;https://www.redtube.com;Adult
10720;app.8tube;8tube.xxx;8tube;8tube is a pornographic website allowing users to watch, share and upload video and audio files.;https://www.8tube.xxx;Adult
10721;app.youjizz;youjizz;Youjizz Porn Tube;Youjizz is a pornographic website allowing users to watch, share and upload video and audio files.;https://www.youjizz.com;Adult
10722;app.zyxel;Zyxel;Zyxel;Zyxel is a networking company providing innovative and reliable Internet solutions.  The company specializes in gigabit networks, 11ac, 802.11ac, DSL, VDSL2, vectoring, Range Extenders and more.;https://www.zyxel.com;Device/IoT
10723;app.brother;Brother;Brother;You can access the Brother official site of your country / region.  A leader in the manufacturing and service of Printers, Labellers, Scanners, Fax & Sewing.;https://global.brother;Device/IoT
10724;app.gmx-mail;GMX;GMX;GMX Mail is a free advertising-supported email service.  Users may access GMX Mail via webmail as well as via POP3 and IMAP4 protocols.;https://www.gmx.net/;Mail
10725;app.wayfair;Wayfair;Wayfair;Wayfair is an online retailer of home products for bedroom, living room, kitchen and dining, home entertainment, bathroom, and more.;https://www.wayfair.com;Shopping
10726;app.fedex;Fedex;Fedex;Fedex is an international shipping company.  It provides customers and businesses worldwide with a broad portfolio of transportation, e-commerce and business services.;https://www.fedex.com/;Business
10727;app.split-io;Split;Split;Split Software is a feature delivery platform that builds better software for engineering teams. Its feature delivery platform pairs the speed and reliability of feature flags with data to measure the impact of every feature.;https://www.split.io;Business
10728;app.bnp-paribas;BNP Paribas;BNP Paribas;BNP Paribas a French bank and international financial services provider for corporate, institutional and individual clients.  It is present across Europe, the Americas, and Asia.;https://mabanque.bnpparibas;Financial
10729;app.hsbc;HSBC;HSBC;HSBC is one of the largest banking and financial services institutions in the world, serves millions of customers through its four Global Businesses.;https://www.hsbc.com;Financial
10730;app.teads;Teads;Teads;Teads is an outstream video advertising platform and advertising marketplace. Advertisers work with Teads to create new video inventory, monetizing it through various sales channels.;https://www.teads.com;Advertiser
10731;app.tapad;Tapad;Tapad;Tapad is a global marketing technology company providing a comprehensive suite of identity-based marketing solutions.;https://www.tapad.com;Advertiser
10732;app.booyah-advertising;Booyah Advertising;Booyah Advertising;Booyah Networks is a digital advertising and marketing company. Through Booyah and SpotXchange brands, the company offers digital advertising efforts to reach customers.;https://www.booyahadvertising.com;Advertiser
10733;app.google-cloud;Google Cloud Platform;Google Cloud Platform;Google Cloud Platform, offered by Google, is a suite of cloud computing services that runs on the same infrastructure that Google uses internally for its end-user products.;https://cloud.google.com;Hosting
10734;app.eero;Eero;Eero;Eero - an Amazon company - provides whole-home wireless systems that deliver WiFI to every room.  It was one of the first products to popularize multi-point mesh Wi-Fi systems.;https://eero.com;Device/IoT
