id;tag;short_name;full_name;description;url;category
10305;app.manitu-hosting;Manitu Hosting;Manitu Hosting;Manitu not only provides German-based web hosting, servers, and DNS, but also runs an antispam/antimalware blacklist system.;https://www.manitu.de;Hosting
10306;app.clearfoundation;ClearFoundation;ClearFoundation;ClearFoundation is a non-profit Incorporated Society that develops and manages the source code and repository of its flagship operating system namely ClearOS.;https://clearfoundation.co.nz;Business
10307;app.qnap;QNAP Systems;QNAP Systems;QNAP designs and delivers high-quality network attached storage (NAS) and professional network video recorder (NVR) solutions to users from home, SOHO to small, medium businesses.;https://www.qnap.com;Device/IoT
10308;app.rackspace;Rackspace;Rackspace;Rackspace provides dedicated and cloud infrastructure.  The company also offers web, app, email hosting, data services and managed security solutions.;https://www.rackspace.com;Hosting
10309;app.lijit;Lijit Popups;Lijit Popups;The lijit.com domain has a poor reputation.  The domain is used to generate advertising income from PUP (Potentially Unwanted Program) programs.;https://lijit.com/;Malware
10310;app.ubiquiti;Ubiquiti;Ubiquiti;Ubiquiti manufactures wireless data communication products for enterprise and wireless broadband providers with a primary focus on under-served and emerging markets.;https://www.ui.com;Device/IoT
10311;app.intuit;Intuit;Intuit;Intuit is an American business and financial software company that develops and sells financial, accounting, and tax preparation software and related services for small businesses, accountants, and individuals.;https://www.intuit.com;Financial
10312;app.roku;Roku;Roku;Roku provides the simplest way to stream entertainment to your TV.  A Roku allows you to watch free and paid video content on your TV via the Internet.;https://www.roku.com;Device/IoT
10313;app.rogers;Rogers;Rogers;Rogers Communications Inc. is a Canadian communications and media company in the field of wireless communications, cable television, telephone, and Internet connectivity with significant additional telecommunications and mass media assets.;https://www.rogers.com;ISP/Telco
10314;app.huawei;Huawei;Huawei;Huawei Technologies Co., Ltd. is a Chinese multinational technology company that provides telecommunications equipment and sells consumer electronics, including smartphones;https://www.huaweicloud.com;Device/IoT
10315;app.yealink;Yealink;Yealink;Yealink is a global unified communication (UC) solution provider that primarily offers video conferencing systems and voice communication solutions.;https://www.yealink.com;Device/IoT
10316;app.digitalocean;DigitalOcean;DigitalOcean;DigitalOcean provides developers cloud services that help to deploy and scale applications that run simultaneously on multiple computers.;https://www.digitalocean.com;Hosting
10317;app.linode;Linode;Linode;Linode provides developers cloud services that help to deploy and scale applications that run simultaneously on multiple computers.;https://www.linode.com;Hosting
10318;app.freshworks;Freshworks;Freshworks;Freshworks provides organizations of all sizes with SaaS customer engagement solutions that make it easy for support, sales and marketing professionals to communicate effectively with customers;https://www.freshworks.com;Business
10319;app.devicescape;Devicescape;Devicescape;Devicescape develops client/server software services for wireless networking connectivity, analytics, and context-awareness.  Precision location services for marketers, advertisers and more.;http://www.devicescape.com;Advertiser
10320;app.vodafone;Vodafone;Vodafone;Vodafone is a British multinational telecommunications company that owns and operates mobile networks in overs 25 countries.;https://www.vodafone.com;ISP/Telco
10321;app.candy-crush;Candy Crush;Candy Crush;Candy Crush is a family of free-to-play match-three puzzle video games released by King Games.;https://www.king.com/game/candycrush;Games
10322;app.king-games;King Games;King Games;King.com Limited, trading as King and also known as King Digital Entertainment, is a video game developer based in St. Julian's, Malta, that specialises in the creation of social games.;https://king.com;Games
10323;app.mpulse-performance;Akamai mPulse;Akamai mPulse;Akamai mPulse is a real user monitoring (RUM) solution that enables developers, admins, and performance engineers to easily see website performance problems and discover optimization opportunities;https://www.akamai.com;Advertiser
10324;app.seesaw;Seesaw;Seesaw;Seesaw is a student-driven digital portfolio that empowers students to independently document what they are learning at school.;https://web.seesaw.me;Career and Education
10325;app.cbs;CBS;CBS;CBS is an American English language commercial broadcast television and radio network that is a flagship property of CBS Corporation.;https://www.cbs.com;Arts and Entertainment
10326;app.sony;Sony;Sony;Sony's businesses includes consumer and professional electronics, gaming, entertainment, and financial services.  The company owns the largest music entertainment and video game console businesses in the world.;https://www.sony.net;Business
10327;app.tp-link;TP-Link;TP-Link;TP-Link is a provider of consumer WiFi networking devices, shipping products to over 170 countries and hundreds of millions of customers.;https://www.tp-link.com;Device/IoT
10328;app.usenetserver;UsenetServer;UsenetServer;Usenetserver.com provides access to Usenet news groups and NNTP feeds for business and private use.;https://www.usenetserver.com;File Sharing
10329;app.grammarly;Grammarly;Grammarly;Grammarly is a technology company that develops a digital writing tool using artificial intelligence and natural language processing.   Online tools to make messages, documents, and posts clear, mistake-free, and effective.;https://www.grammarly.com;Career and Education
10330;app.maxmind;MaxMind;MaxMind;MaxMind is a provider of IP intelligence and online fraud prevention tools.;https://www.maxmind.com;Cybersecurity
10331;app.amplitude;Amplitude;Amplitude;Amplitude is a product analytics software company for web and mobile.  Companies use Amplitude to set product strategy, increase key metrics like user engagement, retention, and conversion.;https://amplitude.com;Advertiser
10332;app.rfihub;Rfihub Adware;Rfihub Adware;The rfihub.com domain has a poor reputation.  The domain is used to generate advertising income from PUP (Potentially Unwanted Program) programs. The company is now part of Amazon Advertising via a number of acquisitions.;https://malwaretips.com/blogs/remove-p-rfihub-com/;Malware
10333;app.nodejs;Node.js;Node.js;Node.js is an open-source, cross-platform, JavaScript runtime environment that executes JavaScript code outside of a browser.;https://nodejs.org/;Technology
10334;app.nethserver;NethServer;NethServer;NethServer is an operating system for Linux enthusiasts, designed for small offices and medium enterprises.;https://www.nethserver.org;OS/Software Updates
10335;app.mikrotik;MikroTik;MikroTik;MikroTik is a Latvian company which was founded in 1996 to develop routers and wireless ISP systems. MikroTik now provides hardware and software for Internet connectivity in most of the countries around the world.;https://mikrotik.com;Device/IoT
10336;app.opentable;OpenTable;OpenTable;OpenTable is an online restaurant-reservation service company.  End users can make online reservations, read restaurant reviews from diners, and earn points towards free meals.;https://www.opentable.com/;Recreation
10337;app.xfinity;Xfinity;Xfinity;Xfinity is a trade name of Comcast Cable Communications, LLC, a subsidiary of the Comcast Corporation, used to market consumer cable television, internet, telephone, and wireless services provided by the company.;https://www.xfinity.com;ISP/Telco
10338;app.comcast;Comcast;Comcast;Comcast owns and operates a number of companies.  In telecommunications: Xfinity, Comcast Business.  In TV: NBC, Telemundo, TeleXitos, Cozi TV, MSNBC, CNBC, USA Network, Syfy, NBCSN, and E!, and more.  In film: Universal Pictures.;https://corporate.comcast.com;Arts and Entertainment
10339;app.itarian;ITarian;ITarian;ITarian is an IT Industry Platform that provides IT management software and business automation tools for the enterprise.;https://www.itarian.com;Business
10340;app.yelp;Yelp;Yelp;Yelp is a popular online directory for discovering local businesses ranging from bars, restaurants, and cafes to hairdressers, spas, and gas stations. Users can search Yelp via its website or with the official Yelp apps on iOS and Android smart devices.;https://www.yelp.com;Recreation
10341;app.disney;Disney;Disney;Disney is a diversified multinational mass media and entertainment conglomerate.  The parent company operates Walt Disney Pictures, Pixar, Marvel, Lucasfilm, 20th Century Fox, Disney Parks, ABC TV, ESPN and more.;http://www.disney.com;Arts and Entertainment
10342;app.ironsource;ironSource;ironSource;Ironsource is a mobile advertising technology platform that includes in-app video support, mediation platforms, and data drive user acquisition.;https://www.ironsrc.com;Advertiser
10343;app.godaddy;GoDaddy;GoDaddy;GoDaddy is an internet domain registration company that offers website hosting, online marketing and security services for individuals and businesses.;https://www.godaddy.com;Hosting
10344;app.google-voice;Google Voice;Google Voice;Google Voice is a telephone service that provides call forwarding and voicemail services, voice and text messaging, as well as U.S. and international call termination for Google Account customers.;https://voice.google.com;VoIP/Conferencing
10345;app.kissmetrics;Kissmetrics;Kissmetrics;Kissmetrics is an analytics platform that provides marketing solution for web and mobile applications.;https://www.kissmetricshq.com;Advertiser
10346;app.cloudmark;Cloudmark;Cloudmark;Cloudmark is a provider of sender reputation, messaging security and infrastructure solutions for targeted email threats.;https://cloudmark.com;Cybersecurity
10347;app.pfsense;pfSense;pfSense;pfSense is a free and open source firewall and router that also features unified threat management, load balancing, multi WAN, and more;https://www.pfsense.org;Cybersecurity
10348;app.opnsense;OPNsense;OPNsense;OPNsense is open source, FreeBSD-based firewall and routing software.  Along with acting as a firewall, it has traffic shaping, load balancing, and virtual private network capabilities, and more.;https://opnsense.org;Cybersecurity
10349;app.conduit-toolbar;Conduit Toolbar;Conduit Toolbar;The application is used for legitimate advertising, but it also has a poor reputation.  The application is used to generate advertising income from PUP (Potentially Unwanted Program) programs.;https://en.wikipedia.org/wiki/Conduit_toolbar;Malware
10350;app.spameatingmonkey;Spam Eating Monkey;Spam Eating Monkey;Spam Eating Monkey is a responsive realtime IP and URI reputation service used to block unwanted email.;https://spameatingmonkey.com;Cybersecurity
10351;app.rspamd;Rpsamd;Rpsamd;Rspamd is an advanced spam filtering system supporting a variety of filtering mechanisms including regular expressions, statistical analysis and custom services such as URL black lists.;https://rspamd.com;Cybersecurity
10352;app.barracuda;Barracuda;Barracuda;Barracuda Networks, Inc. is a company providing security, networking and storage products based on network appliances and cloud services.;http://barracudacentral.org;Cybersecurity
10353;app.sorbs;SORBS;SORBS;SORBS (Spam and Open Relay Blocking System) provides free access to its DNS-based Block List (DNSBL) to effectively block email from more than 12 million host servers known to disseminate spam, phishing attacks and other forms of malicious email.;http://www.sorbs.net;Cybersecurity
10354;app.senderscore;Sender Score;Sender Score;Sender Score is mail reputation system.  Mailbox providers take a lot of metrics into consideration to determine your sender reputation including spam complaints, mailing to unknown users, industry blacklists, and more.;https://www.senderscore.org;Cybersecurity
10355;app.spamcannibal;SpamCannibal;SpamCannibal;SpamCannibal is a defunct spam reputation system.  It used a list of identified spam sources (IP addresses) to know what to block.;https://www.theregister.co.uk/2018/05/30/spamcannibal_hijack/;Cybersecurity
10356;app.lastpass;LastPass;LastPass;LastPass is a freemium password manager that stores encrypted passwords online. The standard version of LastPass comes with a web interface, but also includes plugins for various web browsers and apps for many smartphones.;https://www.lastpass.com;Business
10357;app.vestel-appliances;Vestel Appliances;Vestel Appliances;Vestel is a Turkish home and professional appliances manufacturing company.  Other companies will brand Vestel products as their own.;https://vestelinternational.com;Device/IoT
10358;app.cnbc;CNBC;CNBC;CNBC is the world leader in business news and real-time financial market coverage.;https://www.cnbc.com;News
10359;app.thetvdb;TheTVDB;TheTVDB;TheTVDB.com is a community driven database of television shows. All content and images on the site have been contributed by the site's users, the site uses moderated editing to maintain its own standards.;https://www.thetvdb.com/;Arts and Entertainment
10360;app.tmdb;The Movie Database;The Movie Database;The Movie Database (TMDb) is a popular, user editable database for movies and TV shows.;https://www.themoviedb.org;Arts and Entertainment
10361;app.flickr;Flickr;Flickr;Flickr is an image hosting service and video hosting service.  It supports an active and engaged community where people share and explore each other's photos.;https://flickr.com;Social Media
10362;app.hulu;Hulu;Hulu;Hulu is a U.S.-based subscription video on demand service fully controlled and majority-owned by Walt Disney;https://www.hulu.com/;Streaming Media
10363;app.tinder;Tinder;Tinder;Tinder is a location-based social search mobile app and Web application most often used as a dating service, that allows users to use a swiping motion to like or dislike other users, and allows users to chat if both parties like each other.;https://tinder.com;Social Media
10364;app.sonos;Sonos;Sonos;Sonos manufactures wireless home sound systems - a whole-house WiFi network that fills your home with brilliant sound, room by room.;https://www.sonos.com;Device/IoT
10365;app.zoho;Zoho;Zoho;Zoho is a web-based online office suite containing word processing, spreadsheets, presentations, databases, note-taking, wikis, web conferencing, customer relationship management, project management, invoicing, and other applications.;https://www.zoho.com;Business
10366;app.mopub;MoPub;MoPub;MoPub provides monetization solutions for mobile app publishers and developers around the globe.;https://www.mopub.com;Advertiser
10367;app.amazon-assistant;Amazon Assistant;Amazon Assistant;Amazon Assistant (Amazon Browser App) is an Amazon web browser toolbar that provides  advertising and marketing opportunities for its parent company.;https://www.amazon.com/gp/BIT;Advertiser
10368;app.blizzard;Blizzard Entertainment;Blizzard Entertainment;Blizzard is a developer and publisher of video games, responsible for some of the most popular titles worldwide like World of Warcraft, Overwatch, the Starcraft series and the Diablo series.  The company is a subsidiary of Activision Blizzard.;https://www.blizzard.com;Games
10369;app.philips;Philips;Philips;Philips is a Dutch multinational corporation and one of the largest electronics companies in the world, currently focused in the area of healthcare and lighting;https://www.philips.com;Device/IoT
10370;app.t-mobile;T-Mobile;T-Mobile;T-Mobile - owned by German Deutsche Telekom - is the third largest wireless carrier in the United States;https://www.t-mobile.com;ISP/Telco
10371;app.spamassassin;SpamAssassin;SpamAssassin;Apache SpamAssassin is an open source anti-spam platform giving system administrators a filter to classify email and block spam.;https://spamassassin.apache.org;Cybersecurity
10372;app.xiaomi;Xiaomi;Xiaomi;Xiaomi is a Chinese electronics company that makes smartphones, mobile apps, laptops, bags, trimmers, earphones, shoes, fitness bands, and many other products.;https://www.mi.com/global;Device/IoT
10373;app.npr;NPR;National Public Radio;NPR - National Public Radio - delivers breaking US national and world news. Also top stories from business, politics, health, science, technology, music, arts and culture.;https://www.npr.org;Arts and Entertainment
10374;app.belkin;Belkin;Belkin;Belkin is a manufacturer of consumer electronics that specializes in connectivity devices.  The company sells wireless chargers, screen protectors, charging cables, and more.;https://www.belkin.com;Device/IoT
10375;app.xiongmai;Xiongmai;Xiongmai;Xiongmai is a Chinese maker of electronic parts that power digital video recorders (DVRs) and network security cameras.  The company has a rather infamous information security reputation.;http://www.xiongmaitech.com;Device/IoT
10376;app.netgear;Netgear;Netgear;Netgear designs branded networking products that address the specific needs of small and medium business and home users.;https://www.netgear.com;Device/IoT
10377;app.uk-government;UK Government;UK Government;Sites on the gov.uk domain provide public sector information and a point of access to government services for the United Kingdom.;https://www.gov.uk;Government
10378;app.debian;Debian;Debian;Debian is a Linux operating system and a distribution of Free Software. It is maintained and updated through the work of many users who volunteer their time and effort.;https://www.debian.org;OS/Software Updates
10379;app.new-york-times;The New York Times;The New York Times;The New York Times is a morning daily newspaper published in New York City.  It is considered one of the newspapers of record in the United States.;https://www.nytimes.com;News
10380;app.umeng;Umeng;Umeng;Umeng+ is a Beijing-based startup providing mobile app analytics solutions for mobile development teams and individual developers.;https://www.umeng.com;Advertiser
10381;app.alexa;Alexa.com;Alexa.com;Alexa.com, a subsidiary of Amazon, provides brands, marketers, and agencies with a full suite of SEO and competitor analysis tools.;https://www.alexa.com;Advertiser
10382;app.jquery;jQuery;jQuery;jQuery is a popular JavaScript library used by web sites around the world.  It is designed to simplify HTML DOM tree traversal and manipulation, as well as event handling, CSS animation, and Ajax.;https://jquery.com;Technology
10383;app.logitech;Logitech;Logitech;Logitech International is a provider of personal computer and mobile peripherals - mice, keyboards, headsets, controllers and more.;https://www.logitech.com;Device/IoT
10384;app.support-intelligence;Support Intelligence;Support Intelligence;Support Intelligence is a network security company that provides high quality, actionable information on malicious network activity.;http://support-intelligence.com;Cybersecurity
10385;app.bluekai;BlueKai;BlueKai;BlueKai is a cloud-based big data platform that enables companies to personalize online, offline, and mobile marketing campaigns.  The company is now owned by Oracle and the app is now merged with Oracle Advertising.;https://en.wikipedia.org/wiki/BlueKai;Advertiser
10386;app.adsafeprotected;Integral Ads;Integral Ads;Integral Ad is an advertiser that solves problems for brands, agencies, publishers, and technology companies by verifying that every impression has the opportunity to be effective.;https://integralads.com/;Advertiser
10387;app.ruckus-networks;Ruckus Networks;Ruckus Networks;Ruckus Networks, is a company selling wired and wireless networking equipment and software.  The company offers Wi-Fi, switching, cloud and software products to mobile carriers, broadband service providers, and corporate enterprises.;https://www.ruckuswireless.com;Device/IoT
10388;app.merkle-marketing;Merkle Marketing;Merkle Marketing;Merkle is a customer relationship management agency that designs, executes and evaluates integrated marketing programs.;https://www.merkleinc.com;Advertiser
10389;app.audible;Audible;Audible;Audible - an Amazon company - is a seller and producer of spoken audio entertainment, information, and educational programming on the Internet.;https://www.audible.com;Arts and Entertainment
10390;app.taboola;Taboola;Taboola;Taboola is an advertising platform that provides widgets such as the "Around the Web" and "Recommended For You" boxes at the bottom of many online news articles.;https://www.taboola.com;Advertiser
10391;app.amazon-devices;Amazon Devices;Amazon Devices;This application is a catch-all for Amazon's device metrics and services for Alexa, Echo, Kindle, Fire, Firesticks and other Amazon hardware.;https://www.amazon.com/;Device/IoT
10392;app.apple-siri;Apple Siri;Apple Siri;Siri is a built-in intelligent assistant that enables users of Apple iPhones, iPads and iPod Touch devices to speak natural language voice commands in order to operate the mobile device and its apps.;https://www.apple.com;Business
10393;app.thawte;Thawte;Thawte;Thawte was an SSL/TLS certificate authority and vendor.  The company offered easy online management of SSL certificates and code signing certificates.  The brand has been absorbed into Digicert.;https://www.thawte.com;Cybersecurity
10394;app.suspicious-activity;Suspicious;Suspicious;Suspicious activity - apps that look suspicious and are currently under review.;https://www.netify.ai/why-netify/cyberthreat-analysis;Malware
10395;app.hbo;HBO;Home Box Office;HBO (Home Box Office) is an American premium cable and satellite television network owned by WarnerMedia.  The programming includes movies, television shows, documentaries, and comedy and concert specials.;https://www.hbo.com;Streaming Media
10396;app.nvidia;Nvidia;Nvidia;Nvidia is known as a market leader in the design of graphics processing units, or GPUs, for the gaming market, as well as system on chips, or SOCs, for the mobile computing and automotive markets.;https://www.nvidia.com;Business
10397;app.silicondust;SiliconDust;SiliconDust;SiliconDust creates the HDHomerun - a TV tuner that takes the signal from an over-the-air antenna and shares it over your home network;https://www.silicondust.com;Device/IoT
10398;app.zombo;zombo.com;zombo.com;You can do anything at zombo.com.  The site parodies Flash introductory web pages that play while the rest of a site's content loads.;http://zombo.com;Arts and Entertainment
10399;app.pulseway;Pulseway;Pulseway;Pulseway is a remote monitoring and management RMM software that helps MSP's and IT professionals control their IT infrastructure on the go.;https://www.pulseway.com;Business
10400;app.vizio;VIZIO;VIZIO;VIZIO designs and manufactures televisions, sound bars, speakers, and SmartCast Tablet Remote products. It offers products through retailers and online.;https://www.vizio.com/;Device/IoT
10401;app.facebook-messenger;Facebook Messenger;Facebook Messenger;Facebook Messenger is a messaging app and platform.  Users can send messages and exchange photos, videos, stickers, audio, files, and more.;https://www.messenger.com;Messaging
10402;app.wechat;WeChat;WeChat;WeChat is a Chinese multi-purpose messaging, social media and mobile payment app developed by Tencent.;https://www.wechat.com;Messaging
10403;app.canon;Canon;Canon;Canon is a multinational corporation specializing in the manufacture of imaging and optical products, including cameras, camcorders, photocopiers, steppers, computer printers and medical equipment;https://global.canon;Device/IoT
10404;app.site247;Site24x7;Site24x7;Site24x7 offers website monitoring services.  Customer can monitor websites remotely and receive instant email/sms alerts if a site becomes unavailable.;https://www.site24x7.com;Business
10405;app.trustarc;TrustArc;TrustArc;TrustArc (formerly TRUSTe) is a privacy compliance technology company that provides software and services to help organizations update their privacy management processes so they comply with government laws and best practices.;https://www.trustarc.com/;Cybersecurity
10406;app.arin-net;ARIN;American Registry for Internet Numbers;The American Registry for Internet Numbers (ARIN) is the regional Internet registry for Canada, the United States, and many Caribbean and North Atlantic islands. ARIN manages the distribution of Internet number resources.;https://www.arin.net;Technology
10407;app.verizon-wireless;Verizon Wireless;Verizon Wireless;Verizon Wireless is a large American telecommunications company which offers wireless products and services.  Can you hear me now?;https://www.verizonwireless.com;Business
10408;app.qihoo-360;Qihoo 360;Qihoo 360;Qihoo 360 is a Chinese internet security company known for its antivirus software, web browsers, and mobile application store.;https://www.360.cn;Cybersecurity
10409;app.mgid;MGID;MGID;MGID is an advertising platform that helps retain audiences and monetize traffic, drives performance and brand awareness, using non-intrusive ad formats.;https://www.mgid.com;Advertiser
10410;app.psbl;PSBL;Passive Spam Block List;Passive Spam Block List (PSBL) is an easy-on, easy-off blacklist that does not rely on testing and should reduce false positives because any user can remove their ISP's mail server from the list.;https://psbl.org;Cybersecurity
10411;app.anubisnetworks;AnubisNetworks;AnubisNetworks;AnubisNetworks is a threat intelligence and email security supplier.  Their product is a secure email service that protects against ransomware, spam, business email compromise (BEC), spoofing, and phishing.;https://www.anubisnetworks.com/;Cybersecurity
